{
  "schemaVersion": 1,
  "id": "wireframe-project-defined",
  "family": "wireframe",
  "subtype": "ui-layout",
  "provenance": {
    "standard": "Project-defined wireframe notation; WCAG 2.2 is an accessibility reference, not a wireframe notation",
    "version": "2.2",
    "source": "https://www.w3.org/TR/WCAG22/",
    "mcpDiscovery": {
      "server": "drawio",
      "build": "42835e3@2026-08-02T20:17:10.515Z",
      "verifiedAt": "2026-08-11T00:00:00Z",
      "results": [
        { "query": "bootstrap button", "title": "Button, primary", "styleSha256": "73fb2e4b653eb2538da3beb65d6b7ab7b4538b666d56d90588de3428739a2ace" }
      ]
    }
  },
  "nodeTypes": {
    "screen": { "styleMatchers": [{ "allOf": ["container=1", "swimlane"] }], "shapeClass": "screen", "container": true },
    "bootstrap-button": { "styleMatchers": [{ "allOf": ["shape=mxgraph.bootstrap.rrect", "rSize=5"] }], "shapeClass": "rounded-rectangle" },
    "control": { "styleMatchers": [{ "allOf": ["html=1", "whiteSpace=wrap"], "noneOf": ["text;", "shape="] }], "shapeClass": "rectangle" }
  },
  "edgeTypes": {
    "interaction": { "direction": "directed", "style": { "endArrow": "block" } }
  },
  "rules": [
    { "id": "component-contract-required", "severity": "ERROR", "description": "Declare viewport units, fidelity, design-system version, component states, interaction legend, and repeated-component groups before approval." },
    { "id": "accessibility-boundary", "severity": "WARNING", "description": "A diagram can flag contrast, label, and target-size risks but cannot prove implemented WCAG conformance." },
    { "id": "spatial-consistency", "severity": "ERROR", "description": "Preserve containment, alignment, spacing, z-order, and declared dimensions for every repeated-component group." },
    { "id": "interaction-semantics-explicit", "severity": "ERROR", "description": "Map every interaction edge to a declared interaction-legend entry." },
    { "id": "live-style-not-design-system-proof", "severity": "WARNING", "description": "The live Bootstrap-style button proves renderer availability only; confirm component semantics, state, and design-system version separately." }
  ]
}
